{
  "id": "ptp-009",
  "pins": [
    {
      "id": "p1",
      "x": 120,
      "y": 130
    },
    {
      "id": "p2",
      "x": 200,
      "y": 260
    }
  ],
  "balls": [
    {
      "id": "b1",
      "x": 80,
      "y": 40,
      "color": "red"
    },
    {
      "id": "b2",
      "x": 240,
      "y": 40,
      "color": "red"
    }
  ],
  "cups": [
    {
      "id": "c1",
      "x": 130,
      "y": 400,
      "width": 60,
      "height": 60,
      "acceptColor": "red"
    }
  ],
  "channels": [
    {
      "segments": [
        [
          80,
          60,
          80,
          130
        ],
        [
          80,
          130,
          160,
          260
        ]
      ],
      "blockedByPin": "p1"
    },
    {
      "segments": [
        [
          240,
          60,
          240,
          260
        ],
        [
          240,
          260,
          160,
          400
        ]
      ],
      "blockedByPin": "p2"
    },
    {
      "segments": [
        [
          160,
          260,
          160,
          400
        ]
      ],
      "blockedByPin": "p2"
    }
  ],
  "difficulty": 3
}
