{
  "id": "ptp-014",
  "pins": [
    {
      "id": "p1",
      "x": 80,
      "y": 130
    },
    {
      "id": "p2",
      "x": 160,
      "y": 200
    },
    {
      "id": "p3",
      "x": 240,
      "y": 130
    },
    {
      "id": "p4",
      "x": 160,
      "y": 340
    }
  ],
  "balls": [
    {
      "id": "b1",
      "x": 80,
      "y": 40,
      "color": "red"
    },
    {
      "id": "b2",
      "x": 240,
      "y": 40,
      "color": "red"
    },
    {
      "id": "b3",
      "x": 160,
      "y": 40,
      "color": "blue"
    },
    {
      "id": "b4",
      "x": 160,
      "y": 40,
      "color": "blue"
    }
  ],
  "cups": [
    {
      "id": "c1",
      "x": 70,
      "y": 400,
      "width": 60,
      "height": 60,
      "acceptColor": "red"
    },
    {
      "id": "c2",
      "x": 190,
      "y": 400,
      "width": 60,
      "height": 60,
      "acceptColor": "blue"
    }
  ],
  "channels": [
    {
      "segments": [
        [
          80,
          60,
          80,
          130
        ],
        [
          80,
          130,
          100,
          400
        ]
      ],
      "blockedByPin": "p1"
    },
    {
      "segments": [
        [
          240,
          60,
          240,
          130
        ],
        [
          240,
          130,
          100,
          400
        ]
      ],
      "blockedByPin": "p3"
    },
    {
      "segments": [
        [
          160,
          60,
          160,
          200
        ],
        [
          160,
          200,
          160,
          400
        ]
      ],
      "blockedByPin": "p2"
    }
  ],
  "difficulty": 4
}
