{
  "id": "ptp-002",
  "pins": [
    {
      "id": "pin-0",
      "x": 202.63901058584452,
      "y": 168.96883361041546
    },
    {
      "id": "pin-1",
      "x": 158.6488375067711,
      "y": 145.23153924383223
    },
    {
      "id": "pin-2",
      "x": 87.09488283842802,
      "y": 253.4776641521603
    }
  ],
  "balls": [
    {
      "id": "ball-0",
      "x": 80,
      "y": 30.973670901730657,
      "color": "blue"
    },
    {
      "id": "ball-1",
      "x": 160,
      "y": 38.344957237131894,
      "color": "red"
    },
    {
      "id": "ball-2",
      "x": 240,
      "y": 30.425722624640912,
      "color": "yellow"
    }
  ],
  "cups": [
    {
      "id": "cup-0",
      "x": 55,
      "y": 400,
      "width": 50,
      "height": 60,
      "acceptColor": "blue"
    },
    {
      "id": "cup-1",
      "x": 135,
      "y": 400,
      "width": 50,
      "height": 60,
      "acceptColor": "red"
    },
    {
      "id": "cup-2",
      "x": 215,
      "y": 400,
      "width": 50,
      "height": 60,
      "acceptColor": "yellow"
    }
  ],
  "channels": [
    {
      "segments": [
        [
          80,
          30.973670901730657,
          31.171532878652215,
          153.98244726782042
        ],
        [
          31.171532878652215,
          153.98244726782042,
          49.10968436859548,
          276.9912236339102
        ],
        [
          49.10968436859548,
          276.9912236339102,
          80,
          400
        ]
      ],
      "blockedByPin": "pin-2"
    },
    {
      "segments": [
        [
          160,
          38.344957237131894,
          204.8998014163226,
          158.8966381580879
        ],
        [
          204.8998014163226,
          158.8966381580879,
          202.8756990795955,
          279.4483190790439
        ],
        [
          202.8756990795955,
          279.4483190790439,
          160,
          400
        ]
      ],
      "blockedByPin": "pin-1"
    },
    {
      "segments": [
        [
          240,
          30.425722624640912,
          205.28907716274261,
          122.81929196848068
        ],
        [
          205.28907716274261,
          122.81929196848068,
          210.9486776450649,
          215.21286131232046
        ],
        [
          210.9486776450649,
          215.21286131232046,
          233.96221121773124,
          307.6064306561602
        ],
        [
          233.96221121773124,
          307.6064306561602,
          240,
          400
        ]
      ],
      "blockedByPin": "pin-0"
    }
  ],
  "difficulty": 1
}
