{
  "id": "ptp-019",
  "pins": [
    {
      "id": "p1",
      "x": 70,
      "y": 90
    },
    {
      "id": "p2",
      "x": 160,
      "y": 90
    },
    {
      "id": "p3",
      "x": 250,
      "y": 90
    },
    {
      "id": "p4",
      "x": 70,
      "y": 220
    },
    {
      "id": "p5",
      "x": 250,
      "y": 220
    }
  ],
  "balls": [
    {
      "id": "b1",
      "x": 70,
      "y": 40,
      "color": "red"
    },
    {
      "id": "b2",
      "x": 160,
      "y": 40,
      "color": "blue"
    },
    {
      "id": "b3",
      "x": 250,
      "y": 40,
      "color": "green"
    },
    {
      "id": "b4",
      "x": 115,
      "y": 40,
      "color": "yellow"
    }
  ],
  "cups": [
    {
      "id": "c1",
      "x": 40,
      "y": 400,
      "width": 48,
      "height": 60,
      "acceptColor": "red"
    },
    {
      "id": "c2",
      "x": 98,
      "y": 400,
      "width": 48,
      "height": 60,
      "acceptColor": "blue"
    },
    {
      "id": "c3",
      "x": 156,
      "y": 400,
      "width": 48,
      "height": 60,
      "acceptColor": "green"
    },
    {
      "id": "c4",
      "x": 214,
      "y": 400,
      "width": 48,
      "height": 60,
      "acceptColor": "yellow"
    }
  ],
  "channels": [
    {
      "segments": [
        [
          70,
          60,
          70,
          90
        ],
        [
          70,
          90,
          70,
          220
        ],
        [
          70,
          220,
          70,
          400
        ]
      ],
      "blockedByPin": "p1"
    },
    {
      "segments": [
        [
          160,
          60,
          160,
          90
        ],
        [
          160,
          90,
          160,
          400
        ]
      ],
      "blockedByPin": "p2"
    },
    {
      "segments": [
        [
          250,
          60,
          250,
          90
        ],
        [
          250,
          90,
          250,
          220
        ],
        [
          250,
          220,
          250,
          400
        ]
      ],
      "blockedByPin": "p3"
    },
    {
      "segments": [
        [
          115,
          60,
          115,
          400
        ]
      ],
      "blockedByPin": "p4"
    }
  ],
  "difficulty": 5
}
