{
  "id": "ptp-004",
  "pins": [
    {
      "id": "pin-0",
      "x": 97.83381782472134,
      "y": 266.4592156652361
    },
    {
      "id": "pin-1",
      "x": 233.86205464601517,
      "y": 275.13296846300364
    },
    {
      "id": "pin-2",
      "x": 225.84952365607023,
      "y": 113.07994495145977
    }
  ],
  "balls": [
    {
      "id": "ball-0",
      "x": 80,
      "y": 55.258567503187805,
      "color": "green"
    },
    {
      "id": "ball-1",
      "x": 160,
      "y": 48.6228919448331,
      "color": "blue"
    },
    {
      "id": "ball-2",
      "x": 240,
      "y": 31.202262472361326,
      "color": "red"
    }
  ],
  "cups": [
    {
      "id": "cup-0",
      "x": 55,
      "y": 400,
      "width": 50,
      "height": 60,
      "acceptColor": "green"
    },
    {
      "id": "cup-1",
      "x": 135,
      "y": 400,
      "width": 50,
      "height": 60,
      "acceptColor": "blue"
    },
    {
      "id": "cup-2",
      "x": 215,
      "y": 400,
      "width": 50,
      "height": 60,
      "acceptColor": "red"
    }
  ],
  "channels": [
    {
      "segments": [
        [
          80,
          55.258567503187805,
          19.189759818837047,
          141.44392562739085
        ],
        [
          19.189759818837047,
          141.44392562739085,
          23.14200664870441,
          227.6292837515939
        ],
        [
          23.14200664870441,
          227.6292837515939,
          14.55154144205153,
          313.81464187579695
        ],
        [
          14.55154144205153,
          313.81464187579695,
          80,
          400
        ]
      ],
      "blockedByPin": "pin-0"
    },
    {
      "segments": [
        [
          160,
          48.6228919448331,
          192.29666935279965,
          165.74859462988871
        ],
        [
          192.29666935279965,
          165.74859462988871,
          211.98872961103916,
          282.87429731494433
        ],
        [
          211.98872961103916,
          282.87429731494433,
          160,
          400
        ]
      ],
      "blockedByPin": null
    },
    {
      "segments": [
        [
          240,
          31.202262472361326,
          205.89851849712431,
          123.401696854271
        ],
        [
          205.89851849712431,
          123.401696854271,
          230.62353913206607,
          215.60113123618066
        ],
        [
          230.62353913206607,
          215.60113123618066,
          205.39987463504076,
          307.80056561809033
        ],
        [
          205.39987463504076,
          307.80056561809033,
          240,
          400
        ]
      ],
      "blockedByPin": "pin-2"
    }
  ],
  "difficulty": 1
}
