{
  "id": "ptp-007",
  "pins": [
    {
      "id": "p1",
      "x": 160,
      "y": 160
    },
    {
      "id": "p2",
      "x": 80,
      "y": 300
    },
    {
      "id": "p3",
      "x": 240,
      "y": 300
    }
  ],
  "balls": [
    {
      "id": "b1",
      "x": 160,
      "y": 40,
      "color": "green"
    }
  ],
  "cups": [
    {
      "id": "c1",
      "x": 130,
      "y": 400,
      "width": 60,
      "height": 60,
      "acceptColor": "green"
    }
  ],
  "channels": [
    {
      "segments": [
        [
          160,
          60,
          160,
          160
        ],
        [
          160,
          160,
          160,
          400
        ]
      ],
      "blockedByPin": "p1"
    }
  ],
  "difficulty": 2
}
